{
  "job_id": "unknown-b24106727c7c393fd62f",
  "created_at": "2026-08-07T14:49:51+00:00",
  "client_id": "demo-or-unassigned",
  "source": {
    "kind": "outlook_triage",
    "path": "",
    "message_id": "8868a62d5c080305b915",
    "thread_ref": "8868a62d5c080305b915"
  },
  "route": {
    "product": "unknown",
    "confidence": 0.2,
    "reason": "No configured route keywords matched."
  },
  "status": "blocked",
  "risk": "sensitive",
  "inputs": [
    {
      "kind": "email_record",
      "subject": "Theresa Malebe",
      "sender": "Theresa Malebe",
      "attachment_names": "",
      "intent": "meeting_or_scheduling",
      "urgency": "high",
      "next_step": "Review availability, then insert/send manually from Outlook if appropriate.",
      "draft_status": "draft_ready",
      "primary_draft_path": "/home/byron/Desktop/KnowEdge_Outlook_Triage_DROP_IN_BUILD_WIX4_FIXED/triage_output_playwright/drafts/primary_8868a62d5c080305b915_Theresa_Malebe.txt",
      "safer_draft_path": "/home/byron/Desktop/KnowEdge_Outlook_Triage_DROP_IN_BUILD_WIX4_FIXED/triage_output_playwright/drafts/safer_8868a62d5c080305b915_Theresa_Malebe.txt",
      "shorter_draft_path": "/home/byron/Desktop/KnowEdge_Outlook_Triage_DROP_IN_BUILD_WIX4_FIXED/triage_output_playwright/drafts/shorter_8868a62d5c080305b915_Theresa_Malebe.txt",
      "evidence_note_path": "/home/byron/Desktop/KnowEdge_Outlook_Triage_DROP_IN_BUILD_WIX4_FIXED/triage_output_playwright/drafts/evidence_note_8868a62d5c080305b915_Theresa_Malebe.txt"
    }
  ],
  "evidence": [
    {
      "evidence_id": "b24106727c7c393fd62f",
      "source_type": "email",
      "source_path": "",
      "title": "Theresa Malebe",
      "date_observed": "2026-08-07T14:49:51+00:00",
      "text_extract": "Evidence note for: Theresa Malebe\n\nEvidence seen:\n- Sender visible: Theresa Malebe\n- Subject visible: Theresa Malebe\n- Folder/source context: Inbox\n- Body text or preview reviewed.\n- Risk flags assigned: contains_email_address, contains_identifier_or_private_info, contains_phone_number\n\nMissing information:\n- Confirmed availability\n\nThis note is for review and audit. It is not an outbound email.",
      "hash": "e16cb0e04a8468472438",
      "claims": [],
      "mapped_to": [],
      "confidence": 0.2,
      "review_status": "candidate"
    }
  ],
  "outputs": [],
  "approval": {
    "required": true,
    "state": "pending"
  },
  "billing": {
    "invoice_id": null,
    "payment_status": "not_required"
  }
}